JPY_TokyoCPIexFreshFood;20101125;23:30;Tokyo CPI ex Fresh Food (YoY);Japan;JPY;1
JPY_ConsumerPriceIndex;20101125;23:30;Tokyo Consumer Price Index (YoY);Japan;JPY;1
JPY_TokyoCPIexFoodEnergy;20101125;23:30;Tokyo CPI ex Food, Energy (YoY);Japan;JPY;1
JPY_NationalCPIexFoodEnergy;20101125;23:30;National CPI ex Food, Energy (YoY);Japan;JPY;2
JPY_NationalCPIexFreshFood;20101125;23:30;National CPI ex-Fresh Food (YoY);Japan;JPY;2
GBP_CBIDistributiveTradesSurveyRealized;20101125;11:00;CBI Distributive Trades Survey - Realized (MoM);United Kingdom;GBP;1
CHF_EmploymentLevel;20101125;08:15;Employment Level (QoQ);Switzerland;CHF;2
AUD_PrivateCapitalExpenditure;20101125;00:30;Private Capital Expenditure;Australia;AUD;1
USD_ThanksgivingDay;20101125;00:00;Thanksgiving Day;United States;USD;1
