JPY_TokyoCPIexFreshFood;20100624;23:30;Tokyo CPI ex Fresh Food (YoY);Japan;JPY;2
JPY_ConsumerPriceIndex;20100624;23:30;Tokyo Consumer Price Index (YoY);Japan;JPY;2
JPY_TokyoCPIexFoodEnergy;20100624;23:30;Tokyo CPI ex Food, Energy (YoY);Japan;JPY;2
JPY_NationalCPIexFoodEnergy;20100624;23:30;National CPI ex Food, Energy (YoY);Japan;JPY;2
NZD_TradeBalance;20100624;22:45;Trade Balance (MoM);New Zealand;NZD;2
USD_JoblessClaims;20100624;12:30;Continuing Jobless Claims;United States;USD;1
USD_DurableGoodsOrders;20100624;12:30;Durable Goods Orders ex Transportation;United States;USD;3
EUR_EurIndustrialNewOrders;20100624;09:00;Industrial New Orders (YoY);European Monetary Union;EUR;1
