CAD_NewHousingPriceIndex;20091013;12:30;New Housing Price Index (MoM);Canada;CAD;1
EUR_EurZEWSurveyEconomicSentiment;20091013;09:00;ZEW Survey - Economic Sentiment;European Monetary Union;EUR;2
EUR_GerZEWSurveyEconomicSentiment;20091013;09:00;ZEW Survey - Economic Sentiment;Germany;EUR;2
GBP_RetailPriceIndex;20091013;08:30;Retail Price Index (MoM);United Kingdom;GBP;1
GBP_DCLGHousePriceIndex;20091013;08:30;DCLG House Price Index (YoY);United Kingdom;GBP;1
GBP_ConsumerPriceIndex;20091013;08:30;Consumer Price Index (MoM);United Kingdom;GBP;2
CHF_ProducerandImportPrices;20091013;07:15;Producer and Import Prices (MoM);Switzerland;CHF;1
AUD_NationalAustraliaBankBusinessConditions;20091013;01:30;National Australia Bank Business Conditions;Australia;AUD;1
AUD_NationalAustraliaBankBusinessConfidence;20091013;00:30;National Australia Bank Business Confidence;Australia;AUD;2
