JPY_IndustrialProduction;20081028;23:50;Industrial Production (MoM);Japan;JPY;1
NZD_TradeBalance;20081028;21:45;Trade Balance (MoM);New Zealand;NZD;2
USD_ConsumerConfidence;20081028;14:00;Consumer Confidence;United States;USD;2
USD_RichmondFedManufacturingIndex;20081028;14:00;Richmond Fed Manufacturing Index;United States;USD;1
USD_S&PCaseShillerHomePriceIndices;20081028;13:00;S&P/Case-Shiller Home Price Indices (YoY);United States;USD;1
GBP_CBIDistributiveTradesSurveyRealized;20081028;11:00;CBI Distributive Trades Survey - Realized (MoM);United Kingdom;GBP;1
ISK_CBIInterestRateDecision;20081028;09:00;CBI Interest Rate Decision;Iceland;ISK;1
CHF_UBSConsumptionIndicator;20081028;09:00;UBS Consumption Indicator;Switzerland;CHF;1
EUR_GerGfkConsumerConfidenceSurvey;20081028;07:00;Gfk Consumer Confidence Survey;Germany;EUR;1
