CAD_CanadianPortfolioInvestmentinForeignSecurities;20100618;12:30;Canadian Portfolio Investment in Foreign Securities;Canada;CAD;1
CAD_ForeignPortfolioInvestmentinCanadianSecurities;20100618;12:30;Foreign Portfolio Investment in Canadian Securities;Canada;CAD;1
CAD_LeadingIndicators;20100618;12:30;Leading Indicators (MoM);Canada;CAD;1
GBP_MortgageApprovals;20100618;08:30;Mortgage Approvals;United Kingdom;GBP;1
GBP_M4MoneySupply;20100618;08:30;M4 Money Supply (YoY);United Kingdom;GBP;1
GBP_PublicSectorNetBorrowing;20100618;08:30;Public Sector Net Borrowing;United Kingdom;GBP;1
EUR_GerProducerPriceIndex;20100618;06:00;Producer Price Index (MoM);Germany;EUR;2
