JPY_MerchandiseTradeBalanceTotal;20080325;23:50;Merchandise Trade Balance Total;Japan;JPY;1
JPY_AdjustedMerchandiseTradeBalance;20080325;23:50;Adjusted Merchandise Trade Balance;Japan;JPY;1
JPY_CorporateServicePrice;20080325;23:50;Corporate Service Price (YoY);Japan;JPY;1
NZD_BuildingPermits;20080325;21:45;Building Permits s.a. (MoM);New Zealand;NZD;1
USD_ConsumerConfidence;20080325;14:00;Consumer Confidence;United States;USD;2
USD_HousingPriceIndex;20080325;14:00;Housing Price Index (MoM);United States;USD;2
USD_RichmondFedManufacturingIndex;20080325;14:00;Richmond Fed Manufacturing Index;United States;USD;2
USD_S&PCaseShillerHomePriceIndices;20080325;13:00;S&P/Case-Shiller Home Price Indices (YoY);United States;USD;1
CAD_RetailSales;20080325;12:30;Retail Sales ex Autos (MoM);Canada;CAD;2
