JPY_AllIndustryActivityIndex;20081021;23:50;All Industry Activity Index (MoM);Japan;JPY;1
USD_CentralBankSpeech;20081021;23:30;Treasury Secretary Paulson speech;United States;USD;2
NZD_VisitorArrivals;20081021;21:45;Visitor Arrivals (YoY);New Zealand;NZD;1
GBP_CentralBankSpeech;20081021;19:10;BoE Governor King speech;United Kingdom;GBP;2
CAD_BoCInterestRateDecision;20081021;13:00;BoC Interest Rate Decision;Canada;CAD;3
GBP_CBIIndustrialTrendsSurveyOrders;20081021;10:00;CBI Industrial Trends Survey - Orders (MoM);United Kingdom;GBP;1
CHF_TradeBalance;20081021;06:15;Trade Balance;Switzerland;CHF;1
AUD_NewMotorVehicleSales;20081021;00:30;New Motor Vehicle Sales (MoM);Australia;AUD;1
AUD_RBAMeetingMinutes;20081021;00:30;RBA Meeting Minutes;Australia;AUD;2
