NZD_TradeBalance;20090727;22:45;Trade Balance (MoM);New Zealand;NZD;2
USD_CentralBankSpeech;20090727;22:00;Former Fed Chair Bernanke speech;United States;USD;2
USD_NewHomeSalesChange;20090727;14:00;New Home Sales Change (MoM);United States;USD;2
USD_NewHomeSales;20090727;14:00;New Home Sales (MoM);United States;USD;2
HUF_MNBInterestRateDecision;20090727;11:30;MNB Interest Rate Decision;Hungary;HUF;1
EUR_EurM3MoneySupply;20090727;08:00;M3 Money Supply (YoY);European Monetary Union;EUR;1
EUR_GerGfkConsumerConfidenceSurvey;20090727;06:00;Gfk Consumer Confidence Survey;Germany;EUR;1
